1,網路購票超過時間需要候補可以接受，現場無座椅提供給候位者只有咖啡消費區才提供座位區
1,"它是地標,多數人知道它是國父記念館,而不清楚它實稱為逸仙公園  晨早即有運動人群在此聚集,而後老者前來聊天,再而後遊客觀賞參展人士  園內樹木花卉噴水池厠所停車場,大致評語不差"
1,食物樣式不多，沒有太大特色，且價格偏貴！
1,蚊子超多，也沒什麼特別值得看的，不知道是不是導覽員的問題，大部分時間都不在植物園，植物園內的導覽以站在廁所前面的講看不到的鳥和植物最久，然後大部分時間都在植物園外走路
1,櫃台小姐態度不是普通的差
1,改建後北門更為整潔，交通便利
1,就是以前灌溉水溝沒什麼特色
1,建築很美，但裡面的人眼睛長在頭頂上
1,每天營業的卡拉OK，吵死人，市府水力處互丟皮球，無做為不管理，爛死了
1,安靜清幽，環境乾淨整潔，給顆心的原因是停車場保全服務態度極差，上班聊天就算了，管理的亂七八糟，建議行天宮更換間保全公司！
1,到處都是在走動的人群裡面抽煙的！食安堪慮！小孩不要帶來逛，吸二手菸都飽了！
1,我只能說：裏面的作品夠資格在這展出嗎？可能今次的展出不合我口胃吧！
1,站務人員非常敬業，第13號月台上方的監視器千萬不要無聊就去看，站務人員就會把你當可疑份子驅趕，還有，我在站長休息室外聞到菸味這也許是他驅趕我的理由吧2017／09／08下午12點38分紀錄
1,步道木板壞得很嚴重，希望部要有人受傷了!
1,經常有運動民眾將汽車駛入草皮或運動徒步區卻從未見過拖吊取締
1,偶而會有不經意的碰到小動物亦或小昆蟲
1,不錯的場所，本來印象還不錯，但是清潔人員很糟糕，尤其是個大媽他手中有清潔工具及垃圾袋，公園上沒有垃圾桶，要丢垃圾竟然裝耳聾跑給我追，如果不爽給丢，叫柯P市府團隊注意增加垃圾桶
2,看什麼鳥，沒有decent的廁所，另外其實不能算公園，只算腳踏車和慢跑休憩場所
2,失望，個家族的興衰，和宅邸的感覺似乎有關，從巷內走進，完全不覺得正常，似乎是走入廢棄社區～
2, 餐廳糟透了真的很慢而且服務很差    
2,參觀博物館，停車費還要錢，而且小時40元超貴 去次下次就不想去了 小朋友也沒得玩
2,其實沒有啥好吃的，所以後來都去頂好買菜自己煮XD
2, 普通  只是輛模擬舊公共汽車  沒什麼特別的    
2,非商業拍照不能停超過五分鐘挺限制的
2, 這是種像這樣的感覺我去了旅遊路線，我去了那裡，因為它是個旅遊景點，但我認為，如果我個人，我沒有停止    
2,硬體設施過舊，綠化維護般般
2,人潮壅擠  找不到車位  太耗費時間了
2,靠近夜市假日香客衆多      靠近夜市假日香客眾多
2,人氣與流水客大跌，且空置店面很多
2,1 可遠眺台北市區，視野不錯，能見度良好時，可以看到林口  2［十八王公廟的強迫推銷手法］買金紙和餅乾，不先說明價錢，等你拿在手上，才說$700，反應太貴，又改說$500，$300，讓人感受很差，強烈建議廟方加強管理  3 呈上，告知只需要燒第張寫姓名地址的金紙，卻將其餘金紙收回，不知道是否真的有幫忙燒掉  4 香爐附近有個駝背戴紅色帽子的婆婆，看似好心指引參拜方向，結果最後是要販售項鍊$100
2,太髒又沒什麽管理，街友太多
2,超值溜小孩地點，但人很多
2,目前櫻花徐徐慢開中應該是半個月後可看性更高
2,1樹火紀念紙博物館是處可以短暫停留的地點  2館內樓梯有間隙，若有幼小孩童需多加留意  3館內無親子廁所較不方便  4館內無無障礙坡道電梯  5館內設施對於年幼孩童較沒有吸引力  6捷運忠孝新生站下車，４號出口出站沿松江路步行往北長安東路右轉，約１０分鐘
3,適合運動，健走及騎腳踏車
3,這藝術館的前身是我當年原本要就讀的學校，如今已搖身變為展覽會場，身為台北市民有空可來走遭，看看有何新奇的展覽！
3, 這是座天主教堂大安公園對面    
3,房子很不错，日式风格很赞里面展品不多，除了个书房就没有关于梁先生的物件感觉票价50贵了      房子很不錯，日式風格很贊裡面展品不多，除了個書房就沒有關於梁先生的物件感覺票價50貴了
3,房子修的不錯但不知道裡面是幹啥的？
3,昨天首次去此公園  雖有草地 但稍嫌稀疏 且看見狗便 就不敢脫鞋打赤腳走在草地上也  因看見位外籍人士狗走在草地上欵~ :(
3,停車規劃不佳，商家很友善
3,"台大新生南路旁的圍牆拆除了, 改成了小橋流水的景色 可是大馬路旁, 感覺怪怪的"
3,整潔，為有進出有時要跟機車搶道，安全自己要小心
3,給三星是還沒開放真可惜．
3,有特別的外型 內部有經過設計的衣服
3,六巨石附近的觀景台，可以完整看見台北101的面貌，因距離山腳不遠，也是個欣賞夜景的好地點
3,"地下1樓的按摩店可以體驗下費用從10分鐘100元到全身按摩60分鐘700元都有,環境可以有清潔人員維護"
3,所買的鳥類日用品及食物都比較貴店舖不算多
3,這是艋舺地區名列第三級古蹟，是艋舺頗負盛名的廟宇，來萬華[艋舺]定要參拜
3,橋景優美，但愛心湖與夫妻樹， 感覺有點硬拗出來的景點，沒有明顯特色
3,人好多，大家都在抓寶，小心不長眼的路人
4,華山大草原新建設的遊樂園  設施開放使用 很好玩 實用  溜滑梯 玩沙池都規劃的不錯  繩索遊戲好玩 但要注意安全  兒童在玩 家長定要顧 才不會意外
4,學海書院    婁曹同知建文甲    督題贈匾興學政    日禁塾滅淪高祠    廳前楹聯憶文盛
4,看診 等報告 總共等了四小時 停車費都要比門診費貴了  到底是有這麼人力不足到醫生連配個護理師都沒有  還要自己跑進跑出的來拿資料  嚴重點的 沒死也半條命  拿人命開玩笑就是醫者仁心嗎？！
4,古老的迷你公園，設備卻不老舊
4,免購票，若是開車去，旁邊就有停車場，十分方便  小景點，不過也值得看，原來撫臺街是因為清代巡撫衙門的街道
4,原本是日治時期之大正町教會
4,此間正是芋花盛開時間，不論立於何處幾乎滿山芋花，真是數大便是美  瞬間滿腦子對於  目中唯己是，別人非滴洗鳴狼豬銘  忘恩負義滴偷腥渣仔  無用武之地僅會打球滴鍋蓋洗等等掃而空  真為粉久沒有心闊神怡感嘆！
4,公用免費，有置物箱，有洗腳區，先洗腳，再去泡腳，比較衛生
4,可惜小了點，有松鼠，鴿子可玩耍還不錯      可惜小了點，有鬆鼠，鴿子可玩耍還不錯
4,很好！只是假日停車場要等好久
4,商場寬敞舒適，若到附近的話，值得到此遊
4,沉默曾是歷史真正的聲音  大片的肖像空白  其身影消失於恐怖的時代    先民的努力造就現代  我們應承先啟後  為後代創造更好的環境  館內展示雖是悲傷的故事  但仍在在提醒我們誤再重蹈覆轍
4,是傳統夜市，但用餐購物方便
4,逛逛不錯，有許多于右任的書法      逛逛不錯，有許多於右任的書法
4,臺北市內少數非常有歷史味道的郵局，很多觀光客出入寄送明信片哦，櫃員也會說日文，好厲害！
4,建物本身保留了大部份日治時代的風格與身為警察機關特別設計，值得遊！
4,個可以細細品嘗的場域，小而美的藝術空間
5,環境清幽的公園  種了很多梅花
5,不錯，讓我們了解到台灣的歷史
5,規劃的很棒!城市中的綠地，很適合全家人走走逛逛
5,夜晚看星星無光害超棒的！
5,櫻花還是開的不錯的喔，也適合夜拍
5,是個很好浪費時間的地方
5,單車爬坡 健身路跑好地方
5,充滿文藝氣息的擺攤小賣所，維護的很好 是假日散心的好地方
5,在市區保留難得見的古蹟
5,老店依然存在，但待出租的越來越多了
5, 將換崗儀式的主要吸引力是很漂亮    
5,阿不就是陸橋有什麼好評分的？我給五顆星
5,隔了很久再次來這裡，第次這裡是夏天，來這裡還遇到兩隻蛇，那時候這裡環境也很差現在有大片草原，還種了花花草草，水也沒那麼臭了
5,東區必逛的百貨公司，不來可惜
5,營運用心，咖啡品質優秀老板對研究咖啡很有心得，也很友善！值得放空的地方！      營運用心，咖啡品質優秀老闆對研究咖啡很有心得，也很友善！值得放空的地方！
5,以前這裡有賣紅蟲的地方現在沒有了碼頭變成觀光碼頭以前的小龍舟與舢板都變成載客大船雖然還保有龍舟文化的解說牌但是懷舊的感覺都沒了
5, 台北大步道盡頭的好地方    
